<?xml version="1.0" encoding="ISO-8859-1" ?>
<!DOCTYPE configuration SYSTEM "../../../resources/configuration.dtd" >
<configuration>
	<inspect>
		<class knowTime="compiletime" name="dummy.Teacher">
			<method name="getJob">
				<arguments>
				</arguments>
				<return>
					<classType name="java.lang.String"/>
				</return>
			</method>
		</class>
	</inspect>
	<notInspect>
		<pattern>java*</pattern>
	</notInspect>
	<notRemove>
		<pattern>org.w3c.dom.*</pattern>
	</notRemove>
</configuration>
