<?xml version="1.0" encoding="ISO-8859-1" ?>
<!DOCTYPE configuration SYSTEM "../../../resources/configuration.dtd" >
<configuration>
	<programClasspath>
	</programClasspath>
	<inspect>
	</inspect>
	<notInspect>
		<pattern>org*</pattern>
		<pattern>java*</pattern>
	</notInspect>
	<output>
		<directory path="target/test-jminimizer/classes"/>
	</output>
	<report>
		<directory path="target/test-jminimizer/report"/>
	</report>
</configuration>