<?xml version="1.0" encoding="ISO-8859-1" ?>
<!DOCTYPE configuration SYSTEM "../../../resources/configuration.dtd" >
<configuration>
	<programClasspath>
	</programClasspath>
	<inspect>
		<class name="dummy.Person">
			<method name="setName">
				<arguments>
					<classType name="java.lang.String"/>
				</arguments>
				<return>
					<void/>
				</return>
			</method>
			<method name="getName">
				<arguments/>
				<return>
					<classType name="java.lang.String"/>
				</return>
			</method>
		</class>
		<class name="dummy.Teacher">
			<constructor>
				<arguments>
					<classType name="dummy.Teacher"/>
				</arguments>
			</constructor >
		</class>
	</inspect>
	<notInspect>
		<pattern>java*</pattern>
	</notInspect>
	<output>
		<directory path="target/test-jminimizer/classes"/>
	</output>
	<report>
		<directory path="target/test-jminimizer/report"/>
	</report>
</configuration>